DateScraped,CitationNumber,Sequence,ViolationCode,ViolationDescription,Plea,Finding,Dispo,DismissalReason,CloseDate
2023-03-18,9Z0828346,1,SMC11.55.200,MOVING RIGHT/LEFT W/O TURN SIGNAL,,,PN,,
2023-03-18,2A0530631,1,SMC11.52.04001U,SPEED 1-5 MPH >LIMIT  40&UNDR ZN,,,PN,,
2023-03-18,2100935015,1,11.50.140,RED LIGHT CAMERA VIOLATION,,,CN,,07/19/2021
2023-03-18,2200192913,1,11.52.100,"SPEED, SCHOOL CROSSWALKS CAMERA VIOLATION",,,CN,,02/18/2022
2023-03-18,2A0365587,1,SMC11.58.198.C,NO/IMPROPER SAFETY BELT USE (>16),C,C,FE,,12/16/2022
2023-03-18,2A0365587,1,SMC11.55.010,FAIL TO YIELD R/W AT INTERSECTION,C,C,AM,,12/15/2022
2023-03-18,2A0084843,1,SMC11.58.198.C,NO/IMPROPER SAFETY BELT USE (>16),C,C,FE,,11/23/2022
2023-03-18,2A0084843,1,SMC11.50.380,TCD  DISOBEY TRAFFIC CONTROL DEVICE,,,AM,,
